业主急租！汝河路小学旁精装修低楼层两室！家电齐全！拎包入住！,2,1,70,整租,1200,erqi
万象城  大卫城  豫港大厦对面 精装一室一厅出租,1,1,52,整租,1600,erqi
免押金独卫主卧直租 年底甩租 真图实价 独立电表不公摊电费,3,2,35,合租,660,erqi
南三环锦荣ui公寓 家具齐全 拎包入住,1,1,41.5,整租,1000,erqi
二七锦绣田苑一房一厅 精装修，拎包入住，和房东直接签合同,1,1,75,整租,900,erqi
河医片区一室一厅出租，干净整齐可拎包入住。,1,1,41,整租,1100,erqi
二七区嵩山南路，房冬直租，实图实拍，无中介费，可以押一付一,1,1,30,整租,750,erqi
无中介费，升龙国际，二七万达，两室一厅，实拍图，拎包入住,2,1,65,整租,900,erqi
海悦苑 家具家电齐全 拎包入住 南北通透边户，看房方便,3,2,89.7,整租,1600,erqi
海豫花园 京广路长江路路口,1,0,40,整租,800,erqi
精装新房 可短租 可月付无杂费 无中介费直租家电家具齐全,1,1,28,整租,650,erqi
郑大一附院附近鑫苑景园一室出租,1,0,34.4,整租,1000,erqi
房东直租 朝南标准一室一厅 二七万达 升龙国际   拎包入住,1,1,76,整租,1400,erqi
房冬直租 京广快速路 绿地滨湖 百荣世贸 二七广场 实图实价,3,2,130,整租,1200,erqi
升龙国际直租 无中介费 押一付一 短租,3,2,25,合租,400,erqi
房冬直租 绿地滨湖国际中心对面 荆胡商业中心 精装两室双气,2,2,102,整租,1200,erqi
升龙精装大两室 采光视野极好 小区环境好临近人和路小学,2,2,90,整租,1499,erqi
一楼一室一厅，可居住 可办公 方便出入 随时看房,1,1,46,整租,998,erqi
二七万达附近 近地铁口 可短租 押一付一 随时看房随时看入住,1,1,30,整租,890,erqi
可短租 押一付一 独门独户独卫独立网络 干净卫生 安静舒适,1,1,32,整租,890,erqi
没中介费月付南三环橄榄城新公馆精装标间整租实图实价随时看房,1,1,38,整租,1000,erqi
二七区嵩山南路，房冬直租，实图实拍无中介费，可短租，可月付,1,1,29,整租,750,erqi
荆胡村五号院 2室1厅1卫 1150.0元 电梯房 精装修,2,1,72,整租,1200,erqi
二七万达 五号线 齐礼阎地铁口 东方大厦 二七升龙中心 整租,1,1,52,整租,1300,erqi
大学南路 南三环精装两室 近泰宏建业 鑫家盛世元 榕江瑞景园,2,2,90,整租,1200,erqi
百荣附近鑫苑都会广场大都会万科荣寓精美一室等你来住,1,0,24,整租,599,erqi
业主诚心出租！价格可谈！全屋定制家私齐全！拎包入住,3,2,128,整租,1600,erqi
荆胡五号院双床标间  适合打工合租，双气已通 装修精美 物美,1,1,46,整租,900,erqi
1800两卧朝南。过年急租。医学院地铁口中苑名都长租短租都行,2,1,70,整租,1800,erqi
低楼层！带私人露台！亚星盛世家园精装修大两室！家电齐全！,2,2,100,整租,2000,erqi
一楼合租 可短租 齐礼阎地铁口 东方大厦 市二中 升龙国际,3,1,23,合租,450,erqi
房东直签 鑫家丽景园 精装一居 家电齐全 实图实价 随时看房,1,1,60,整租,1000,erqi
啥也不说了，三区精装单间给钱就租.,3,2,25,合租,300,erqi
亚星城市山水大落地窗精装朝南两室随时看房拎包入住,2,2,108,整租,1800,erqi
可短租 可月付 万达旁 航海路  大学路嵩山路 地铁口,2,2,95.7,整租,1600,erqi
押一付一，短租，临轻工业学院，嵩山南路主干道，拎包入住,1,0,24,整租,650,erqi
棉纺路嵩山路中林国际精装修标准一室一厅,1,1,49,整租,1800,erqi
交一压一。过年急租。一附院300米鑫苑景园电梯双气长租短租都,1,1,35,整租,1100,erqi
房东直租 无中介费 燃气已通 随时看房近荆胡 泰宏建业,2,2,90,整租,1200,erqi
朝南户一室一厅900。过年急租。一附院500米鑫苑都市领地,1,1,40,整租,900,erqi
嵩山南路 奥马广场 精装三室 南北通透 实图实拍 拎包入住,3,2,128,整租,1400,erqi
无中介 可短租 独立厨房 京莎广场 海为科技园 京广南路附近,3,1,10,合租,400,erqi
亚星盛世家园 主卧带阳台 精装修 急租 性比房 随时滴滴我,4,1,30.7,合租,500,erqi
京广南路 绿地滨湖 精装两室 实图实拍 设施齐全  拎包入住,2,2,88,整租,1200,erqi
绿地广场旁 随时看房 房东直签 无中介费,3,2,87.8,整租,1400,erqi
南四环高架旁百荣世贸107国道郑州102高中大学南路地铁旁边,3,2,128,整租,1400,erqi
房冬直租无中介费 万科大都会 南四环京广路 百荣世贸对面,3,2,130,整租,1250,erqi
无中介费 南三环 橄榄城都市广场  黄河科技大学 精装两室,2,2,89,整租,1500,erqi
1200电梯双气。中苑名都长租短租都行。医学院地铁口永辉超市,1,1,47,整租,1200,erqi
超大主卧带阳台   出门地铁口  可短租  可月付,3,1,30,合租,500,erqi
可短租 可月付 升龙国际中心A区 电梯房 精装修 44平,1,0,44,整租,1200,erqi
嵩山南路 奥马广场 一室一厅 实图实拍 设施齐全 拎包入住,1,1,61,整租,1000,erqi
嵩山南路 鑫苑名城2号院 整租一室 押一付一,1,1,26,整租,700,erqi
实拍图 住多久签多久 家电齐全 可月付 非中介,1,0,35,整租,900,erqi
Zhen实价格，朝南带大阳台，有暖气，有厨房，可短租，可月付,3,2,30,合租,300,erqi
新上！随时看房 富华花苑 1室1厅1卫 45平 配套齐全,1,1,45,整租,1300,erqi
可短租可月付 升龙国际中心A区 1室 精装修 43平 电梯房,1,0,43,整租,1100,erqi
大学路，长江路，可短租，可月付，带大阳台，有暖气，直租,3,2,30,合租,500,erqi
双十一特惠实图实价万达旁复试一室一厅家电齐全拎包入住无中介费,1,1,26,整租,1300,erqi
万科大都会铂悦苑 3室2厅1卫 南北通透 88平 电梯房,3,2,95.3,整租,1600,erqi
近橄榄城，正商创富欣城免押金，免押金，可押一付一，可短租月付,2,2,30,合租,499,erqi
升龙国际c区精装主卧带阳台出租可短租三个月以上,3,1,25,合租,500,erqi
康桥金域上郡3号院 3室2厅2卫 141平 配套齐全 有钥匙,3,2,141,整租,3000,erqi
实拍，房子不大，但够用，就租300每月，有厨房，洗衣机，热水,3,2,15,合租,300,erqi
可短租月付！大学路升龙国际 二七万达五号线 升龙天玺 政通路,1,1,60,整租,1050,erqi
新房出租 家具家电齐全实拍图可以月付租金不短租,1,0,24,整租,650,erqi
整租 一附院旁鑫苑国际城市花园精装一室月租850元拎包入住,1,1,32,整租,850,erqi
新房出租！轻工职业学院 可以押一付一价格真实家具家电齐全,1,0,24,整租,700,erqi
啥也不说了，二区精装单间给钱就租.,3,2,25,合租,300,erqi
实图拍摄！一室一厅 无中介费 拎包入住 民用家电齐礼阎地铁口,1,1,60,整租,1000,erqi
中亨花园四号院二七广场地铁口  万象城 人民公园豫港大厦,4,1,23,合租,650,erqi
全女生合租，精装单间便宜出租.,3,2,25,合租,300,erqi
亚新嵩山路新公馆 2室1厅1卫 1300.0元 电梯房 ,2,1,36.1,整租,1300,erqi
精装上新 朝阳整租一室 带朝阳阳台 独立厨卫 家具家电齐全,1,1,40,整租,1100,erqi
锦绣田苑丨押一付一丨百荣商贸丨南四环丨大学南路,1,1,63,整租,900,erqi
兴华南街整租 精装一楼两室！一楼！拎包入住随时看，诚心租,2,1,62,整租,1300,erqi
一室一厅 百荣世贸附近 京广快速路 业主 无中介,1,1,60,整租,800,erqi
亚星盛世雅居 精装朝南2室 房子干净拎包入住 中间楼层,2,2,89,整租,2300,erqi
翰林世家 大学路桃源路 三附院五附院 郑州大学 随时看房,1,1,43,整租,1200,erqi
全女生合租 二七万达精装单间给钱就租.,3,2,25,合租,300,erqi
啥也不说了，升龙天玺精装单间给钱就租.,3,2,25,合租,300,erqi
啥也不说了，实价，有暖气，精装单间给钱就租.,3,2,25,合租,350,erqi
适合一个人住 便宜出租 有暖气可短租,3,2,30,合租,300,erqi
东邢花园东院带阳台科技学院对面康师傅食品厂附近押一付一,3,1,30,合租,400,erqi
啥也不说了，兰亭名苑精装单间给钱就租.,3,2,25,合租,300,erqi
兰德喜多家 3室2厅1卫 2500.0元 电梯房 精装修,3,2,93,整租,2600,erqi
个人创业 实拍温馨朝阳 有阳台 南三环地铁口 没有杂费可月付,3,2,19,合租,400,erqi
万象城 大卫城 铭功路 旁 可以短租 月付 免费无线网,4,2,15,合租,450,erqi
新上！！必看好房！次顶层 采光好 二七万达1号院  2室2厅,2,2,88,整租,2000,erqi
万达3号院精装单间出租朝南有暖气可短租2个月以上,3,2,30,合租,400,erqi
啥也不说了，万千主卧独卫精装单间给钱就租.,3,2,25,合租,300,erqi
高性价比整租三室 黄金三楼 齐礼阎地铁口 市八院 省交通研院,3,2,138,整租,2300,erqi
房栋直租 郑大南校区 整租两室 兴华北街桃源路 无中介费,2,1,71.3,整租,1400,erqi
齐礼阎地铁亚星城市山水五十七中兴华小学丹尼斯两室出租时代广场,2,2,103,整租,1500,erqi
嵩山南路 锦绣山河刘砦 精装大2室 户型方正 超大阳光房,2,1,70,整租,900,erqi
南五里堡附近，冯庄地铁口，精装公寓，超低美丽，随时可看,1,1,45,整租,1300,erqi
升龙国际A区温馨次卧 楼下地铁口 二院 大润发 拎包入住甩租,3,1,20,合租,500,erqi
免押金，免押金，可押一付一，可短租，月付正商航海广场京莎广场,2,2,20,合租,500,erqi
啥也不说了，康桥精装单间给钱就租。,3,2,25,合租,300,erqi
啥也不说了，精装单间给钱就租。,3,2,25,合租,350,erqi
可短租 主卧独卫 二七万达 市二院 齐礼闫 升龙国际,3,1,30,合租,500,erqi
干净安静 环境好 有暖气 可短租 押一付一,3,2,30,合租,300,erqi
二七区泰宏建业商住楼可短租可月付无中介费,1,1,35,整租,999,erqi
年底便宜出租 有暖气 可短租 万达附近,3,2,30,合租,300,erqi
实拍主卧带独立洗手间房间 房租月付可以短租 长江路京广南路,3,2,33,合租,580,erqi
主卧带独立卫生间 万达附近 有暖气 可短租 押一付一,3,2,30,合租,300,erqi
实图实价  有暖气独立厨房  可做饭  带燃气,3,2,30,合租,500,erqi
大卫城 万象城人民公园 二七广场附近金博大城主卧独卫无中介费,3,1,25,合租,1000,erqi
有暖气，可短租，可月付，自己的房子没有中介费，随便租,3,2,25,合租,350,erqi
阳台大房间 第二人民医院地铁口 二七万达升龙国际,3,2,30,合租,300,erqi
京广路 华中路 正商城 朝南独卫单间 月付 包物业,1,0,30,合租,850,erqi
嵩山南路 嵩山大厦 电力医院 第十九中学 汝河路可短租月付,3,2,28,合租,500,erqi
康桥玥棠 3室2厅1卫 南北通透 配套齐全 98平,3,2,98,整租,1800,erqi
泰宏建业国际城10号院 2室1厅1卫 1100.0元,2,1,58.7,整租,1100,erqi
房东直租 无中介 南四环京广路附近 精装大两室,2,2,90,整租,1099,erqi
二七区嵩山南路，房冬直租，实图实拍，无中介费，可以押一付一,1,1,24,整租,699,erqi
嵩山南路 锦绣山河刘砦 精装大2室 户型方正 超大阳光房,2,1,85,整租,950,erqi
啥也不说了，老小区精装单间给钱就租.,3,2,25,合租,300,erqi
齐礼阎小区1号院 2室2厅1卫 精装修 电梯房 配套齐全,2,2,89,整租,1999,erqi
可短租，可月付，带朝南大阳台，有暖气，直租房没有中介费,3,2,30,合租,350,erqi
可短租，能月付，年前特价，随时租，对面就是二七万达,3,2,25,合租,388,erqi
业主急租！价格可谈！全屋定制家私！拎包入住！商圈成熟,1,1,54,整租,900,erqi
房冬直租 万科大都会 吉利房子 百荣世贸 南四环京广路交叉口,1,1,65,整租,900,erqi
齐礼闫地铁口 东方大厦精准单间便宜出租.,3,2,25,合租,300,erqi
给兄弟们放福利，精准单间300就租.,3,2,25,合租,300,erqi
直租 精装大三室 百荣商贸城对面绿地滨湖国际中心南四环地铁口,3,2,130,整租,1200,erqi
东邢花园西苑科技学院对面康师傅食品厂附近押一付一家电齐全,3,1,30,合租,400,erqi
房东委托租房 南三环 百姓广场 长江路沿线 亚星 拎包入住,1,1,80,整租,999,erqi
急租  古玩城  升龙国际C区  1室1厅,1,1,58,整租,1500,erqi
长江路京广路，高砦市场，海豫花园，市六院，标准一室，京莎广场,1,0,40,整租,1050,erqi
房东直租 齐礼阎 地铁口 丹尼斯 升龙城 精装一室一厅 边户,1,1,60,整租,1300,erqi
万达旁 地铁附近 锦绣江南 多层5楼 南北通透大三房 诚租,3,2,137.3,整租,2100,erqi
南四环高架旁百荣世贸107国道郑州102高中郑州2中地铁旁边,3,2,129,整租,1000,erqi
新出 齐礼阎地铁口精装两室 随时看房拎包入住 采光好,2,1,89,整租,1800,erqi
啥也不说了，实图 实价 精装单间给钱就租.,3,2,25,合租,300,erqi
免押金，火车站银基，月租，短租，无物业费，房 东直租有热水,2,2,28,合租,360,erqi
89平 亚星盛世雅居 精装朝南大两室 房子干净 家具家电齐全,2,2,34,整租,1900,erqi
啥也不说了，老小区精装单间给钱就租.,3,2,25,合租,300,erqi
押一付一地铁口 医学院 棉纺路 郑大一附院 超大空间 全女生,3,1,30,合租,450,erqi
升龙城中心8号院，AB座。升龙城5号院，3户合租，拎包入住,3,2,25,合租,350,erqi
精装三室两厅两卫  有暖气电梯房   拎包入住,3,2,110,整租,2600,erqi
西陈庄前街 万象城对面 人民公园地铁口 一室一厅 家电齐全,1,1,42,整租,1000,erqi
锦绣山河玉华园 2室2厅1卫 1200.0元 电梯房,2,2,79.1,整租,1200,erqi
啥也不说了，升龙城主卧独卫给钱就租.,3,2,25,合租,300,erqi
出租 齐礼阎2号院精装一室一厅随时看房随时入住价格优惠,1,1,60,整租,1400,erqi
啥也不说了，升龙国际旁老小区精装单间给钱就租.,3,2,25,合租,300,erqi
好房推荐 精装白领大标间 朝南主卧带阳台 温馨舒适拎包入住,3,2,25,合租,499,erqi
牛顿公馆 1室1厅1卫 850.0元 电梯房 精装修,1,1,42,整租,850,erqi
郑大一附院附近鑫苑景园两室出租,2,1,88.2,整租,1800,erqi
2楼！大学路淮河路古玩城升龙天玺三室一厅家电齐全拎包入住,3,1,79,整租,1300,erqi
南三环 嵩山路 精装大两房 急租 带家具家电 拎包入住,2,2,77,整租,1100,erqi
二七区整租复试无中介可月付可短租临近二七万达轻纺城大学南路口,1,1,30,整租,1299,erqi
东邢花园西苑科技学院对面康师傅食品厂附近押一付一家电齐全,3,1,30,合租,400,erqi
整租一室 第一次出租 小区环境好 民水民电 拎包入住无中介费,1,1,60,整租,800,erqi
房东急租 百兴广场附近 兴华雅苑 一室一厅 无杂费,1,1,49,整租,1300,erqi
二七万达 一室一厅 采光好 精装 业主直签,1,1,60,整租,1000,erqi
黄科大 秀水湾 2室整租 精装修 家电家具齐全 拎包入住,2,2,88.1,整租,1500,erqi
齐礼闫地铁口精装一室免费暖气升龙城11号院采光充足干净整洁,1,1,52,整租,1300,erqi
可短租 可月付 万达旁 航海路  大学路嵩山路 地铁口,1,1,41.1,整租,1100,erqi
环境好 停车方便 户型好精装干净双气全齐,1,1,59,整租,1100,erqi
急急急 百荣附近 京广快速路 三室两卫 无杂费,3,2,136,整租,1300,erqi
古玩城旁 精装两室 出租 拎包入住！看房方便！,2,1,80,整租,1350,erqi
新出 陇海路京广路188平电梯三房两卫 双气 办公自住均可,3,2,188,整租,2600,erqi
年前特价，可短租，可月付，直租，500每月，实墙次卧,3,2,30,合租,500,erqi
万科百荣万商国际荣寓 1室1厅1卫 电梯房 24平 精装修,1,1,24.5,整租,700,erqi
万科大都会   经典小三房 看房提前联系,2,2,88.9,整租,1600,erqi
房东直签无中介 二七万达 齐礼闫 嵩山路 南三环 精装大三室,3,2,107.6,整租,1850,erqi
房东直租 无中介 南四环京广路 百荣附近 精装一室一厅,1,1,65,整租,899,erqi
升龙城11号院 实图实价 精装一室一厅 随时看房 拎包即住,1,1,45,整租,1500,erqi
冯庄地铁口 航海广场AB座国际鞋城 图实拍摄 无中介随时看房,3,2,30,合租,600,erqi
二七区，房冬直租，独门独户，无中介费，可以押一付一,1,1,30,整租,750,erqi
整租  齐礼闫地铁口  珠江荣域南苑  2室1厅,2,1,73,整租,1400,erqi
政通路庆丰街地铁五号线京广南路站精装单间出租,3,2,25,合租,450,erqi
泰宏建业国际城10号院 2室1厅1卫 1200.0元,1,0,35,整租,800,erqi
整租  齐礼闫地铁口  珠江荣域北苑,2,1,59.1,整租,1200,erqi
个人房免押金 朝南带阳台 真图实价 短租月付 富达花园轻纺城,2,2,100,整租,1600,erqi
房东直租！品质小区，新房出租，小区环境舒适，交通方便快捷！,3,2,20,合租,450,erqi
亚星盛世雅居 不临街不临路朝南2房，中间楼层采光好,2,1,65,整租,1000,erqi
二七区嵩山南路南四环鑫苑名城二七区整租公寓可以月付不短租,2,2,89,整租,1600,erqi
标准大一室一厅急租 全屋家电可配新 无中介费 拎包入住 速联,1,0,25,整租,650,erqi
价格可谈直租房 五号线地铁口 升龙国际 大学路政通路 采光好,1,1,53,整租,1000,erqi
业主急租！亚星盛世家园精装修一室！家具家电齐全，，拎包入住！,2,1,92,整租,1450,erqi
精美单间 二七广场 仟美学校对面 大卫城 金博大 光彩,1,0,50,整租,900,erqi
朝南房间 押一付一可以短租 连云路爱心路 正商航海广场附近,3,1,25,合租,600,erqi
可短租万科荣寓百荣商贸附近大都会小学旁边绿地滨湖附近精美一室,3,1,28,合租,530,erqi
业主直签 精装修三室 102中学附近 绿地滨湖悠乐汇拎包入住,1,0,24,整租,600,erqi
啥也不说了，新苑精装单间给钱就租.,3,2,128,整租,1200,erqi
河医片棉纺东路钛合佳苑精装修标准一室一厅看房随时拎包入住,3,2,25,合租,300,erqi
二七区大学南路整租一室一厅新房出租无中介费拎包入住押一付一,1,1,55,整租,1800,erqi
特价单间，短租，月付，随时看房，二七万达，5号线地铁,1,1,35,整租,1100,erqi
急！可月付！价格可谈！二七万达简约风两居室随时看房 拎包入住,3,2,26,合租,598,erqi
齐礼阎小区6号院 2室1厅1卫 精装修 80平 电梯房,2,1,93,整租,1500,erqi
暖气已开，精心布置，实拍，可短租，可月付，就租这个价，,2,1,80,整租,2000,erqi
全女孩，全女孩，年前特价，月付，短租，都行，给钱就租,3,2,25,合租,388,erqi
业主直签 无中介费 黄金楼朝南 全屋定制 近万科百荣京广路,3,2,30,合租,400,erqi
免押金，免押金，可押一付一，可短租，齐礼阎地铁口.近东方大厦,1,1,65,整租,850,erqi
没中介费月付南三环黄科大西门附近橄榄城新公馆精装标间整租实图,3,1,25,合租,550,erqi
月付，押一付一无物业费，短租。房 东直租鑫都汇火车站银基广场,1,1,39,整租,1300,erqi
二七万达 市第二人民医院 富华花苑 万千世纪城精装单间出租。,2,2,35,合租,360,erqi
火车站二七广场 德化街附近电梯房 单间带暖气  家具齐全,2,2,25,合租,300,erqi
全女生合租 齐礼闫地铁口 东方大厦旁精装单间给钱就租。,4,1,34,合租,550,erqi
啥也不说了，家属院精装单间给钱就租。,3,2,25,合租,399,erqi
升龙国际中心 升龙商业广场 二七万达 市二院精装单间出租。,3,2,25,合租,300,erqi
全女生合租 精装单间给钱就租.,3,2,25,合租,400,erqi
有暖气 可短租 押一付一 无中介费,3,2,25,合租,300,erqi
暖气已开，出门就是齐礼闫地铁口，对面升龙城，东方大厦，鼎盛,3,2,30,合租,300,erqi
火车站附近 银基  万博  凯宾城  带暖气电梯房可短租押一,3,2,25,合租,388,erqi
临东方大厦 升龙广场 齐礼闫地铁口精装修家具齐全环境舒适干净,3,2,30,合租,600,erqi
精装修拎包入住。两梯两户，近冯庄地铁口，航海广场，随时看房。,3,1,25,合租,499,erqi
长江一号小区 次卧出租,3,1,30,合租,500,erqi
全女生合租，万千世纪城精装单间可短租 可月付.,3,1,20,合租,500,erqi
正商城裕园5号院免押金，免押金，可押一付一，可短租，可月付，,3,2,25,合租,300,erqi
升龙城 齐礼闫地铁口 高端小区房子 可短租 有暖气,2,2,110,整租,1800,erqi
金水路大石桥地铁口旁三楼三室一厅出租无中介费,3,2,30,合租,300,erqi
南四环郑密路 和房东签合同 停车方便全新家具家电出租,3,1,75,整租,1300,erqi
碧沙岗公园  大标间 随时看房拎包入住,2,1,90,整租,1000,erqi
南四环京广路百荣世贸附近 精装大两室,1,0,40,整租,1400,erqi
榕江瑞景园 大学路南三环 家具齐全拎包入住,2,2,90,整租,1099,erqi
航海路与建云街 海维科技园 可短租 可月付,2,1,60,整租,1000,erqi
南四环京广南路 百荣世贸旁边 2号线南四环,3,1,25,合租,300,erqi
整租三楼三室金水路大石桥市妇幼郑大一附院三室,3,2,130,整租,1500,erqi
郑一附院 合作路 棉纺东路 魔球公园 开心岛乐园 王立砦,3,1,61,整租,1300,erqi
海为科技园，京莎广场，带大阳台朝南，可短租，能月付,3,1,25,合租,600,erqi
先到先得 真图朝阳带阳台 南三环 橄榄城商圈 可押一付一,3,1,30,合租,400,erqi
嵩山路 南三环 锦和广场 精装修双气两室两厅,3,2,19,合租,400,erqi
全女生合租 实图实价 给钱就租.,2,1,49,整租,1800,erqi
大学路政通路 升龙国际A区精装朝阳大标间,3,2,25,合租,300,erqi
万达 地铁口 飘窗 实墙 便宜出租,3,2,30,合租,300,erqi
年底免押金直租 月租日租大学路轻纺城网商园 小九学校 可短租,3,2,25,合租,499,erqi
可短租 可月付 万达旁 航海路  大学路嵩山路 地铁口,4,2,110,整租,2700,erqi
无中介 黄科大 佛岗新居标间带燃气厨房 橄榄城都市广场南三环,1,1,40,整租,899,erqi
二七万达，60平整租一室一厅一厨一卫朝南，停车方便！,1,1,60,整租,1000,erqi
个人房急租免押金 空调实墙 真实照片 可短租 轻纺城小九美发,3,2,12,合租,400,erqi
交通便利   购物方便 干净整洁,1,0,50,整租,900,erqi
啥也不说了，二七万达 升龙国际精装单间给钱就租.,3,2,25,合租,300,erqi
人民公园地铁口 房东直租 一室一厅 三楼精装修 家电齐全,1,1,60,整租,1350,erqi
嵩山路南三环 标准一室一厅 近融侨悠乐汇 奥玛广场 绿地,1,1,67,整租,999,erqi
可按要求装修 一楼可开店 办公 快递 超市 理发 随时看房,3,1,104,整租,1800,erqi
特价急租！康桥华城朝南一室一厅带阳台 民水民电 家具家电齐全,1,1,36,整租,1000,erqi
实拍 铁道京广家园2期  纯南两房 业主婚房装修 随时拎包住,2,2,90,整租,1800,erqi
主卧带独立卫生间，有厨房，有暖气，可短租，可月付,3,2,30,合租,488,erqi
郑大一附院附近鑫苑景园一室出租,1,0,36.7,整租,900,erqi
空房出租 看中可谈 可办公美容 有钥匙随时看房 邻老郑大河医,1,1,39,整租,1100,erqi
无中介荆胡社区 两室带暖气 绿地滨湖国际 百荣 泰宏建业真图,2,2,100,整租,1299,erqi
无中介荆胡社区 双气 绿地滨湖国际 泰宏建业 百荣 二七万达,1,1,42,整租,999,erqi
炮院家属院 3室2厅1卫 2700.0元 105.0平米,3,2,105,整租,2700,erqi
万科大都会海悦苑 2室2厅1卫 79平 精装修 电梯房,2,2,79.5,整租,1400,erqi
实图 实价 精装单间给钱就租.,3,2,25,合租,300,erqi
临近地铁口温馨一室一厅年底业主大甩租急租 短租月付 直接入住,1,1,41,整租,1300,erqi
二七区，房冬直租，实图实拍，无中介费，可以押一付一,1,1,19,整租,699,erqi
二七区嵩山南路，房冬直租，无中介费，朝南户型，可以押一付一,1,1,31,整租,799,erqi
天擎花园 有暖气 精装独卫大单间 电梯房 精装修 南北通透,3,2,30,合租,960,erqi
泰宏建业国际城商业中心二区 1室1厅1卫 1000.0元,1,1,39,整租,1000,erqi
免押金空调单间 只收房租水电费 独立电表可短租月付,3,2,20,合租,420,erqi
万象城火车站 豫港大厦人民公园地铁口 拎包入住两室整租无中介,2,1,60,整租,1280,erqi
二七万达旁合租单间出租有暖气可月付单独电表电梯房,3,2,34,合租,366,erqi
珍景花园合租房出租新装修有暖气有单独电表可月付,3,2,33,合租,356,erqi
全新家具家电 随时看房 近绿地滨湖 泰宏建业,2,2,100,整租,1300,erqi
二七区 二七万达 齐礼阎地铁口 升龙城房东自住三室两厅两卫,3,2,133.4,整租,3500,erqi
政通路  升龙国际中心 写字楼工作者,3,2,25,合租,400,erqi
南四环京广路百荣世贸附近 精装一室一厅,1,1,65,整租,799,erqi
出租 二七万达附近 齐礼闫地铁口精装一室一厅,1,1,48,整租,1300,erqi
实图实价二七万达附近复试一室一厅家电齐全拎包入住随时看房,1,1,54,整租,1400,erqi
升龙国际b区精装主卧独卫出租有暖气可短租,3,2,25,合租,500,erqi
升龙城8号院 实图实价 齐礼阎地铁口 精装两房 随时看房,2,2,88,整租,2500,erqi
升龙国际，升龙世纪花园，电梯2楼，朝南，家具家电齐全拎包入住,3,2,25,合租,500,erqi
齐礼阎小区1号院，免押金，免押金，可押一付一，可短租，可月付,3,2,30,合租,500,erqi
升龙国际，C8，升龙御玺，陈寨花卉市场，带大阳台，拎包入住,3,1,30,合租,499,erqi
大学路南三环精装卧室带独立阳台可短租三个月以上,3,1,25,合租,450,erqi
免押金直租 独卫次卧 大学路海悦华府 轻纺城对面 独立电表,3,2,25,合租,499,erqi
